Id;Hora de início;Hora de conclusão;Email;Nome;No geral, qual é o seu nível de satisfação com o evento?;Esta é a primeira vez que você participa de eventos como este?;Qual é a probabilidade de você recomendar o evento a um amigo ou colega?;O que você mais gostou no evento?;Como o evento pode ser aprimorado?
1;15/11/2025 17:20;15/11/2025 17:23;anonymous;;5;Sim;8;Gostei da qualidade das palestras e do conhecimento dos palestrantes.;Seria ótimo ter mais tempo para perguntas ao final das palestras.
2;15/11/2025 17:23;15/11/2025 17:24;anonymous;;5;Não;9;A organização e a pontualidade foram excelentes.;Melhorar a sinalização interna para facilitar a localização das salas.
3;15/11/2025 17:24;15/11/2025 17:24;anonymous;;3;Não;6;A infraestrutura estava adequada, mas poderia melhorar o acústico.;Oferecer opções de horários alternativos para workshops concorridos.
4;15/11/2025 17:24;15/11/2025 17:25;anonymous;;4;Não;7;O networking foi o ponto alto para mim.;Sem comentários.
5;15/11/2025 17:25;15/11/2025 17:26;anonymous;;4;Não;8;A dinâmica dos workshops foi interessante, mas faltou mais interação.;Tive um pouco de dificuldade em encontrar a sala da palestra que me inscrevi. Poderiam ter avisos ou indicações no local.
6;15/11/2025 17:27;15/11/2025 17:27;anonymous;;5;Sim;10;O atendimento da equipe foi atencioso e prestativo.;Estava tudo incrível. Parabéns à equipe.
7;15/11/2025 17:27;15/11/2025 17:28;anonymous;;5;Sim;9;Gostei muito dos palestrantes e do conteúdo dos workshops.;A duração da última atividade foi longa demais, ficou cansativo.
8;15/11/2025 17:30;15/11/2025 17:32;anonymous;;4;Sim;8;Muito interessante ouvir os projetos dos palestrantes, gostei das apresentações.;A última atividade foi longa.
